jid,desc,title,date,journal,data_cleaned,eissn,jid_umum
7,"Employees are viewed as one of the company's important assets and need to be managed and developed to support survival and achieve company goals. One form of employee organization that can be carried out by the company is to provide remuneration or salary payments that are appropriate for employees. Salary increases greatly affect employee motivation and productivity in carrying out and completing their work. To determine the amount of salary increase, a system is needed that can support decision making by managers. The use of decision support systems using simple additive weighting (SAW) method is very helpful for managers in making faster and more accurate decisions. The basic concept of the SAW method is to find the weighted sum of performance ratings in each alternative and on all attributes that require the decision matrix normalization process (X) to a scale that can be compared with all available alternative ratings. This method was chosen because it was able to select the best alternative from a number of alternatives based on the criteria determined by the research conducted by looking for weight values ​​for each configuration and then ranking that will determine the optimal alternative.",Decision Support System for Determining Employee Salary Levels on CV. Rezeky Baru Service Lubuk Pakam using the Simple Additive Weighting (SAW) Method,2021-03-30,INTERNATIONAL JOURNAL OF BASIC AND APPLIED SCIENCE,decision support system for determining employee salary levels on cv rezeky baru service lubuk pakam using the simple additive weighting saw method employees are viewed as one of the companys important assets and need to be managed and developed to support survival and achieve company goals one form of employee organization that can be carried out by the company is to provide remuneration or salary payments that are appropriate for employees salary increases greatly affect employee motivation and productivity in carrying out and completing their work to determine the amount of salary increase a system is needed that can support decision making by managers the use of decision support systems using simple additive weighting saw method is very helpful for managers in making faster and more accurate decisions the basic concept of the saw method is to find the weighted sum of performance ratings in each alternative and on all attributes that require the decision matrix normalization process x to a scale that can be compared with all available alternative ratings this method was chosen because it was able to select the best alternative from a number of alternatives based on the criteria determined by the research conducted by looking for weight values for each configuration and then ranking that will determine the optimal alternative,20771223,7
7,"This study is a Decision Support System for determining employee shifts using the Simple Additive Weighting (SAW) method of the SAW method, which is looking for a weighted sum of performance ratings on each alternative on all criteria, making a suitability rating table for each alternative on each specified criteria and make a decision matrix. The application that is built is a web-based application using the PHP programming language and using a MySQL database. The purpose of this study is to solve the problem of Employee Shift computerized, with the existence of this system the Hospital. Bhayangkara Kindergarten. II Medan can provide fast and accurate information.",Decision Support System for Determining Employee Shift in Hospital. Bhayangkara Tk. II Medan with Simple Additive Weighting (SAW) Method,2021-03-30,INTERNATIONAL JOURNAL OF BASIC AND APPLIED SCIENCE,decision support system for determining employee shift in hospital bhayangkara tk ii medan with simple additive weighting saw method this study is a decision support system for determining employee shifts using the simple additive weighting saw method of the saw method which is looking for a weighted sum of performance ratings on each alternative on all criteria making a suitability rating table for each alternative on each specified criteria and make a decision matrix the application that is built is a webbased application using the php programming language and using a mysql database the purpose of this study is to solve the problem of employee shift computerized with the existence of this system the hospital bhayangkara kindergarten ii medan can provide fast and accurate information,20771223,7
7,"The system supports the company's performance appraisal using the AHP (Case Study: PT. Andhy Putra) method, one of which is to find, select, assess and determine the best employees every year to match the abilities and assessment criteria applied so far. PT. Andhy Putra while assessing employee performance, especially in CME and OSP, still experiences shortcomings and weaknesses in determining qualified employees. This employee performance system has problems in assessing the performance appraisal data that is less accurate, which is carried out on a paper-based basis and requires less efficient time and large costs. For that, we need a decision support system in helping PT. Andhy Putra to conduct a performance appraisal every year. The method used in this employee assessment is AHP (Analytical Hierarchy Process), which is often also known as the weighting method. The process hierarchy analytical method is one of the methods used to find weight values ​​based on existing criteria and helps facilitate the ranking of alternatives based on the distance between the positive ideal solution and the negative ideal solution. There are 5 (five) criteria as a tool to assess employee performance, namely commitment to the company, desire for achievement, cooperation, leadership and discipline accompanied by the results of the implementation of this process hierarchy method in the form of ranking the alternatives used. This decision support system is built using the PHP programming language and MySQL database",Decision Support System for Employee Performance Using AHP Method (Case Study: PT. Andhy Putra),2021-12-30,INTERNATIONAL JOURNAL OF BASIC AND APPLIED SCIENCE,decision support system for employee performance using ahp method case study pt andhy putra the system supports the companys performance appraisal using the ahp case study pt andhy putra method one of which is to find select assess and determine the best employees every year to match the abilities and assessment criteria applied so far pt andhy putra while assessing employee performance especially in cme and osp still experiences shortcomings and weaknesses in determining qualified employees this employee performance system has problems in assessing the performance appraisal data that is less accurate which is carried out on a paperbased basis and requires less efficient time and large costs for that we need a decision support system in helping pt andhy putra to conduct a performance appraisal every year the method used in this employee assessment is ahp analytical hierarchy process which is often also known as the weighting method the process hierarchy analytical method is one of the methods used to find weight values based on existing criteria and helps facilitate the ranking of alternatives based on the distance between the positive ideal solution and the negative ideal solution there are  five criteria as a tool to assess employee performance namely commitment to the company desire for achievement cooperation leadership and discipline accompanied by the results of the implementation of this process hierarchy method in the form of ranking the alternatives used this decision support system is built using the php programming language and mysql database,20771223,7
7,"The empowerment of rural communities needs to be done institutional strengthening, increased motivation and self-help in community cooperation, so that in order to assess the success of village development, it is necessary to conduct a targeted, coordinated, integrated and sustainable assessment. with an assessment indicator. Village assessment is best done by comparing the latest development level based on village profile data in accordance with the assessment indicators. This study aims to build a decision support system to determine the best village based on the village assessment score using the Analytic Hierarchy Process (AHP) method. The data used is the village data in the Pagar Merbau sub-district. This best village assessment must pay attention to 6 criteria. The results of the accuracy testing that is performed produce accuracy values ​​from the data output process as much as 5 data. The output of this system is the ranking of each village that has been assessed so as to produce recommendations for decision making in determining the best village.",The Best Village Selection Decision Support System at the District Level Using the AHP Method (Case Study at the Pagar Merbau District Office),2020-12-30,INTERNATIONAL JOURNAL OF BASIC AND APPLIED SCIENCE,the best village selection decision support system at the district level using the ahp method case study at the pagar merbau district office the empowerment of rural communities needs to be done institutional strengthening increased motivation and selfhelp in community cooperation so that in order to assess the success of village development it is necessary to conduct a targeted coordinated integrated and sustainable assessment with an assessment indicator village assessment is best done by comparing the latest development level based on village profile data in accordance with the assessment indicators this study aims to build a decision support system to determine the best village based on the village assessment score using the analytic hierarchy process ahp method the data used is the village data in the pagar merbau subdistrict this best village assessment must pay attention to  criteria the results of the accuracy testing that is performed produce accuracy values from the data output process as much as  data the output of this system is the ranking of each village that has been assessed so as to produce recommendations for decision making in determining the best village,20771223,7
7,"Contract employees in a company are hired to help with the work in the company but it is not unusual to ascertain how the work continues in the company. Determination of contract employees to become permanent employees at PT. Timbang deli, it still looks less precise and takes time, because the assessment and calculation of the results of the determination of contract employees to become employees are still carried out in stages such as file selection, oral tests or written tests, interviews and so on , so that the possibility of errors in the final results from determining contract employees to permanent employees often does not meet the criteria required by the company and hampers the company's performance. This study aims to design a Decision Support System Determining contract employees to be permanent employees who can assist the company in choosing the right employees using Visual Basic 2008 programming language. The results of this study build a decision support system using the method of analytical hierarchy process (AHP) to calculate the results in determining contract employees to become permanent employees and using UML to design programs.",Decision Support System for Determining Contract Employees to Become Permanent Employees at PT. Timbang Deli with Analytical Hierarchy Process (AHP) Method,2021-03-30,INTERNATIONAL JOURNAL OF BASIC AND APPLIED SCIENCE,decision support system for determining contract employees to become permanent employees at pt timbang deli with analytical hierarchy process ahp method contract employees in a company are hired to help with the work in the company but it is not unusual to ascertain how the work continues in the company determination of contract employees to become permanent employees at pt timbang deli it still looks less precise and takes time because the assessment and calculation of the results of the determination of contract employees to become employees are still carried out in stages such as file selection oral tests or written tests interviews and so on  so that the possibility of errors in the final results from determining contract employees to permanent employees often does not meet the criteria required by the company and hampers the companys performance this study aims to design a decision support system determining contract employees to be permanent employees who can assist the company in choosing the right employees using visual basic  programming language the results of this study build a decision support system using the method of analytical hierarchy process ahp to calculate the results in determining contract employees to become permanent employees and using uml to design programs,20771223,7
7,"Food substance subsidize to represent one of most having an effect on matter for impecunious family, pursuant to perception result which have been conducted passing implementation and usage applying program Office of Countryside of Jasmine II which have address in Unnamed Rd, Bar Terap, Perbaungan, Regency of Serdang Bedagai, North Sumatra, inferential that in determining decision of acceptance of food substance subsidize is Office of Countryside of Jasmine II have to design the system of receiver of food substance subsidize for society of Chief of village Mango which indigent effectively and efficient, as well as have to apply the method of Analytical Hierarchy Process (AHP) at acceptance of food substance subsidize.Others need also system implementation of decision supporter by using method of Analytical Hierarchy Process (AHP) to determine the society which indigent in acceptance of food substance subsidize.",Decision Support System for Determining Recipients of Subsidized Food Materials for Poor Families Using the AHP Method at the Melati II Village Office,2019-09-30,INTERNATIONAL JOURNAL OF BASIC AND APPLIED SCIENCE,decision support system for determining recipients of subsidized food materials for poor families using the ahp method at the melati ii village office food substance subsidize to represent one of most having an effect on matter for impecunious family pursuant to perception result which have been conducted passing implementation and usage applying program office of countryside of jasmine ii which have address in unnamed rd bar terap perbaungan regency of serdang bedagai north sumatra inferential that in determining decision of acceptance of food substance subsidize is office of countryside of jasmine ii have to design the system of receiver of food substance subsidize for society of chief of village mango which indigent effectively and efficient as well as have to apply the method of analytical hierarchy process ahp at acceptance of food substance subsidize others need also system implementation of decision supporter by using method of analytical hierarchy process ahp to determine the society which indigent in acceptance of food substance subsidize,20771223,7
7,"The Poor Student Assistance Program (PSAP) is a direct assistance to students and not a scholarship, because it is based on students' economic conditions and not on merit (scholarships). Not all students from poor families can receive the Poor Student Assistance Program (PSAP). So of the many students who are prospective recipients of poor students who have met the criteria for selecting help from poor students, not all of them will be the prospective recipients of these poor students. So that in the selection of prospective beneficiaries of poor students must need a Decision Support System (SPK), so that the school will be helped in determining prospective students who receive Poor Student Assistance (PSAP) so that every student from a poor family can receive such assistance Decision support systems (DSS) are part of a computer-based information system (including knowledge-based systems (knowledge management) that are used to support decision making within an organization or company. poor is Technique for Order Preference by Similarity to Ideal Solution (TOPSIS) TOPSIS provides a solution of a number of possible alternatives by comparing each alternative with the best and the worst alternative alternatives among the alternative problems.",Decision Support System for Poor Student Aid Admission Selection (BSM) using the Topsis Method,2019-09-30,INTERNATIONAL JOURNAL OF BASIC AND APPLIED SCIENCE,decision support system for poor student aid admission selection bsm using the topsis method the poor student assistance program psap is a direct assistance to students and not a scholarship because it is based on students economic conditions and not on merit scholarships not all students from poor families can receive the poor student assistance program psap so of the many students who are prospective recipients of poor students who have met the criteria for selecting help from poor students not all of them will be the prospective recipients of these poor students so that in the selection of prospective beneficiaries of poor students must need a decision support system spk so that the school will be helped in determining prospective students who receive poor student assistance psap so that every student from a poor family can receive such assistance decision support systems dss are part of a computerbased information system including knowledgebased systems knowledge management that are used to support decision making within an organization or company poor is technique for order preference by similarity to ideal solution topsis topsis provides a solution of a number of possible alternatives by comparing each alternative with the best and the worst alternative alternatives among the alternative problems,20771223,7
7,"PT. Nippon Indosari Corpindo, Tbk is one of the companies engaged in the industry where the supply and receipt of goods or materials and support in the running of the production process is the most important thing in the process of running this company. That is why in accepting every item from the supplier, it must be well determined and designed to expedite every process, both production and processing inside. Decision support system that can process all data related to computerized supplier performance in order to get better results is of course using the AHP (Analytical Hierarchy Process) method. Decision support systems by mixing several calculation methods are expected to produce good results and are suitable for determining suppliers with outranking systems so that a viable supplier can be sorted by the best value.","Decision Support System for Determining Suppliers to Purchase Goods using the Analytical Hierarchy Process Method at PT. Nippon Indosari Corpindo, Tbk",2019-09-30,INTERNATIONAL JOURNAL OF BASIC AND APPLIED SCIENCE,decision support system for determining suppliers to purchase goods using the analytical hierarchy process method at pt nippon indosari corpindo tbk pt nippon indosari corpindo tbk is one of the companies engaged in the industry where the supply and receipt of goods or materials and support in the running of the production process is the most important thing in the process of running this company that is why in accepting every item from the supplier it must be well determined and designed to expedite every process both production and processing inside decision support system that can process all data related to computerized supplier performance in order to get better results is of course using the ahp analytical hierarchy process method decision support systems by mixing several calculation methods are expected to produce good results and are suitable for determining suppliers with outranking systems so that a viable supplier can be sorted by the best value,20771223,7
7,"Housing is a basic human need and needs to be fostered and developed for the sake of continuity and improvement of people's lives and settlements which cannot be seen as they mean of need, but more than that it is a human settlement in creating a space of life to promote themselves in revealing their identity. During this time the decision making of home selection desired by consumers still experienced several obstacles, namely the slow process of decision making, inconvenience to the housing environment, credit installments and so on. This is because there is no objective method for deciding on a fast choice based on housing data which is right in accordance with consumer desires. By referring to the solution given by Fuzzy Tsukamoto in helping to make a decision, a decision maker can make decisions about housing according to the desired quickly by comparing all existing criteria. Decision support systems are generally defined as a system that is capable of producing solutions and handling problems. Decision support systems are not intended to replace the role of decision makers, but to help and support decision makers. This Fuzzy Tsukamoto method can determine the preference value of each alternative, and can select the best alternative from a number of alternatives.",House Selection Decision Support System with Fuzzy Tsukamoto Method,2019-09-30,INTERNATIONAL JOURNAL OF BASIC AND APPLIED SCIENCE,house selection decision support system with fuzzy tsukamoto method housing is a basic human need and needs to be fostered and developed for the sake of continuity and improvement of peoples lives and settlements which cannot be seen as they mean of need but more than that it is a human settlement in creating a space of life to promote themselves in revealing their identity during this time the decision making of home selection desired by consumers still experienced several obstacles namely the slow process of decision making inconvenience to the housing environment credit installments and so on this is because there is no objective method for deciding on a fast choice based on housing data which is right in accordance with consumer desires by referring to the solution given by fuzzy tsukamoto in helping to make a decision a decision maker can make decisions about housing according to the desired quickly by comparing all existing criteria decision support systems are generally defined as a system that is capable of producing solutions and handling problems decision support systems are not intended to replace the role of decision makers but to help and support decision makers this fuzzy tsukamoto method can determine the preference value of each alternative and can select the best alternative from a number of alternatives,20771223,7
7,"Employee acceptance factors at SMK Private MUSDA Perbaungan the current applies are education, work experience, GPA, age, interview, personality test, field test and work experience, which are considered necessary to improve the quality of educational institutions. In addition, the process of placing application files is still manual so that prospective applicant files must be evaluated by comparing the file contents with the specified criteria. This series of processes is carried out to supplement the material of consideration in determining what to look for will certainly be very time consuming, so that a decision-making system is needed. Thus, a decision support system for employee acceptance is needed. Decision support systems use the SAW method.",Implementation of an Employee Acceptance Decision Support System Using the Simple Additive Weighting (SAW) Method at the Musda Perbaungan Private Vocational School,2019-09-30,INTERNATIONAL JOURNAL OF BASIC AND APPLIED SCIENCE,implementation of an employee acceptance decision support system using the simple additive weighting saw method at the musda perbaungan private vocational school employee acceptance factors at smk private musda perbaungan the current applies are education work experience gpa age interview personality test field test and work experience which are considered necessary to improve the quality of educational institutions in addition the process of placing application files is still manual so that prospective applicant files must be evaluated by comparing the file contents with the specified criteria this series of processes is carried out to supplement the material of consideration in determining what to look for will certainly be very time consuming so that a decisionmaking system is needed thus a decision support system for employee acceptance is needed decision support systems use the saw method,20771223,7
