jid,desc,title,date,journal,data_cleaned,eissn,jid_umum
7,"Indonesia is a country that is rich in sunshine. Based on NASA's Power Data Access Viewer data in 2021, Indonesia has an average radiation level of 5.6 kWh/m2/day. This situation is a big advantage for Indonesia in utilizing solar energy into electrical energy through photovoltaic, especially in the Semarang City area which has an average radiation level of 5.6 kWh/m2/day. The house where the research is located is in Pudakpayung, Semarang City with a roof area of ​​24m2. The Hybrid Solar Power Plant that is designed is an electric power supply system whose sources come from the Solar Power Plant and the State Electricity Company alternately which are regulated automatically by automatic control equipment with battery capacity mode. The results of the calculation, the required components consist of 9 solar modules with a capacity of 120 WP, 4 batteries with a capacity of 12v100Ah, 1 unit of 3000 Watt inverter and 1 unit of Solar Charger Controller 60A. The results of the tests that have been done, the solar panels produce an average power of 5446 wh per day, the battery will be full at 13.00.",Design of Hybrid Solar Power Plant for household Electricity Loads 1300 VA,2022-03-29,INTERNATIONAL JOURNAL OF BASIC AND APPLIED SCIENCE,design of hybrid solar power plant for household electricity loads  va indonesia is a country that is rich in sunshine based on nasas power data access viewer data in  indonesia has an average radiation level of   kwhmday this situation is a big advantage for indonesia in utilizing solar energy into electrical energy through photovoltaic especially in the semarang city area which has an average radiation level of   kwhmday the house where the research is located is in pudakpayung semarang city with a roof area of m the hybrid solar power plant that is designed is an electric power supply system whose sources come from the solar power plant and the state electricity company alternately which are regulated automatically by automatic control equipment with battery capacity mode the results of the calculation the required components consist of  solar modules with a capacity of  wp  batteries with a capacity of vah  unit of  watt inverter and  unit of solar charger controller a the results of the tests that have been done the solar panels produce an average power of  wh per day the battery will be full at  ,20771223,7
7,"Breast care needs to be done by pregnant women to be able to expedite the release of breast milk. Most pregnant women do not do breast care because of lack of knowledge in breast care itself, lack of information about breast care such as not protruding nipples, or flat, because of the condition of the breasts, especially the nipples. The purpose of this study was to determine the relationship between predisposing factors and breast care for pregnant women in Sungai Orosan Village, Padang Bolak District, North Padang Lawas Regency in 2021. The type of research was quantitative with a cross sectional study design. The population in this study were all pregnant women as many as 36 people. The sample in this study was all pregnant as many as 36 people. Data were analyzed by univariate and bivariate using Chi Square test. The results showed that there was a relationship between knowledge factors (p= 0.004), parity (p= 0.004) and employment status (p= 0.003) with breast care in pregnant women. The conclusion is that there is a relationship between knowledge, parity and employment status with breast care in pregnant women. It is hoped that pregnant women can increase their knowledge about breast care.",Relationship of Predisposing Factors with Breast Care in Pregnant Women in Sungai Orosan Village Padang Bolak District North Law,2022-03-30,INTERNATIONAL JOURNAL OF BASIC AND APPLIED SCIENCE,relationship of predisposing factors with breast care in pregnant women in sungai orosan village padang bolak district north law breast care needs to be done by pregnant women to be able to expedite the release of breast milk most pregnant women do not do breast care because of lack of knowledge in breast care itself lack of information about breast care such as not protruding nipples or flat because of the condition of the breasts especially the nipples the purpose of this study was to determine the relationship between predisposing factors and breast care for pregnant women in sungai orosan village padang bolak district north padang lawas regency in  the type of research was quantitative with a cross sectional study design the population in this study were all pregnant women as many as  people the sample in this study was all pregnant as many as  people data were analyzed by univariate and bivariate using chi square test the results showed that there was a relationship between knowledge factors p   parity p   and employment status p   with breast care in pregnant women the conclusion is that there is a relationship between knowledge parity and employment status with breast care in pregnant women it is hoped that pregnant women can increase their knowledge about breast care,20771223,7
7,"Reproductive Health What is most important is complete physical, mental and social well-being, not only because you are free from disease or disability, in all aspects related to the reproductive system, its functions and processes, including being male or female. The research was conducted to determine the effect of adolescent knowledge about menstruation on personal hygiene behavior when menstruation occurs in environment III, Silandit village. This research is analytic with a cross sectional design, with a population and sample of 33 young women who are in environment III Silandit village. This study shows the results that there is an influence of adolescent knowledge about menstruation on personal hygiene behavior when menstruation occurs in the environment III Silandit village with a value of p = 0.005 &lt;p = 0.05. The conclusion in this study is to be able to provide counseling to adolescents related to reproductive health in adolescents, especially young women by related agencies or related parties.",The Effect of Adolescent Knowledge about Menstruation on Personal Hygiene Behavior during Menstruation in Environment III Silandit Village,2022-03-30,INTERNATIONAL JOURNAL OF BASIC AND APPLIED SCIENCE,the effect of adolescent knowledge about menstruation on personal hygiene behavior during menstruation in environment iii silandit village reproductive health what is most important is complete physical mental and social wellbeing not only because you are free from disease or disability in all aspects related to the reproductive system its functions and processes including being male or female the research was conducted to determine the effect of adolescent knowledge about menstruation on personal hygiene behavior when menstruation occurs in environment iii silandit village this research is analytic with a cross sectional design with a population and sample of  young women who are in environment iii silandit village this study shows the results that there is an influence of adolescent knowledge about menstruation on personal hygiene behavior when menstruation occurs in the environment iii silandit village with a value of p    p    the conclusion in this study is to be able to provide counseling to adolescents related to reproductive health in adolescents especially young women by related agencies or related parties,20771223,7
7,"Water is the most important requirement for life. People would prefer to refill their drinking water to satisfy their needs because it is easier and more efficient. It is important to implement hygiene and sanitation measures at drinking water depots if the drinking water produced is to be healthy and safe. Contamination of water can occur if drinking water depots are not kept clean and sanitary. &nbsp;The research used is a descriptive study conducted in the Barus District, with the goal of providing a description of the depot's hygiene and sanitation, as well as laboratory analysis to identify the total contamination of coliform bacteria in the Barus District's Refill Drinking Water Depot. According to the Minister of Health of the Republic of Indonesia no 43 in 2014. None of the drinking water depots in Barus district met the physical qualifying requirements. The exam resulted in a score of 70 or higher. and the results of laboratory tests on the bacteriological quality of drinking water replenished with all coliform-contaminated drinking water samples that exceeded the quality satandard.&nbsp;&nbsp;&nbsp; As a result, the depot owner should turn on the disinfection equipment when starting work and always pay attention to building sanitation, employee hygiene and maintaining drinking water treatment equipment to prevent contamination of drinking water.","Depot Sanitation, Hygiene, and Analysis of Total Microba Control in Refilled Drinking Water in The Barus District",2022-03-30,INTERNATIONAL JOURNAL OF BASIC AND APPLIED SCIENCE,depot sanitation hygiene and analysis of total microba control in refilled drinking water in the barus district water is the most important requirement for life people would prefer to refill their drinking water to satisfy their needs because it is easier and more efficient it is important to implement hygiene and sanitation measures at drinking water depots if the drinking water produced is to be healthy and safe contamination of water can occur if drinking water depots are not kept clean and sanitary the research used is a descriptive study conducted in the barus district with the goal of providing a description of the depots hygiene and sanitation as well as laboratory analysis to identify the total contamination of coliform bacteria in the barus districts refill drinking water depot according to the minister of health of the republic of indonesia no  in  none of the drinking water depots in barus district met the physical qualifying requirements the exam resulted in a score of  or higher and the results of laboratory tests on the bacteriological quality of drinking water replenished with all coliformcontaminated drinking water samples that exceeded the quality satandard as a result the depot owner should turn on the disinfection equipment when starting work and always pay attention to building sanitation employee hygiene and maintaining drinking water treatment equipment to prevent contamination of drinking water,20771223,7
7,"This research deals with the student’s mastery of vocabulary and reading comprehension.&nbsp; It is aimed at finding out whether there is a high correlation between the mastery of vocabulary and reading comprehension. In this research the population was taken from the 2012/2013 year students of SMP Sacrojes. The total number of the samples was 20 students. After the data had been collected, the writer analyzed the data by using the formula of Pearson Product Moment. After calculating the correlation of mastery vocabulary and reading comprehension test, it was obtained that the correlation coefficient was 0,57.&nbsp; It means that there is a high correlation between mastery of vocabulary and reading comprehension.&nbsp; It implies that the higher the student’s mastery on vocabulary, the better they can comprehend the reading texts.",The Correlation Between Mastery of Vocabulary and Reading Comprehension of the 2012/2013 Year Students at SMP Sacrojes,2022-03-30,INTERNATIONAL JOURNAL OF BASIC AND APPLIED SCIENCE,the correlation between mastery of vocabulary and reading comprehension of the  year students at smp sacrojes this research deals with the students mastery of vocabulary and reading comprehension it is aimed at finding out whether there is a high correlation between the mastery of vocabulary and reading comprehension in this research the population was taken from the  year students of smp sacrojes the total number of the samples was  students after the data had been collected the writer analyzed the data by using the formula of pearson product moment after calculating the correlation of mastery vocabulary and reading comprehension test it was obtained that the correlation coefficient was  it means that there is a high correlation between mastery of vocabulary and reading comprehension it implies that the higher the students mastery on vocabulary the better they can comprehend the reading texts,20771223,7
7,"Mastery of sociolinguistic concepts gives a negative contribution to the achievement of students' pragmatic skills. In accordance with the results of the analysis above, it can be concluded that the mastery of sociolinguistic concepts is not a criterion variable that makes a significant contribution to improving pragmatic skills. Thus, the research hypothesis which says that mastery of sociolinguistic concepts makes a significant contribution to the development of pragmatic skills of Free Methodist 1 Private Junior High School students, is not proven.",Contribution of Mastery of Sociolinguistic Concepts to Pragmatic Skills by Students of Free Mathodist 1 Private Junior High School Medan 2012/2013 Academic Year,2022-03-30,INTERNATIONAL JOURNAL OF BASIC AND APPLIED SCIENCE,contribution of mastery of sociolinguistic concepts to pragmatic skills by students of free mathodist  private junior high school medan  academic year mastery of sociolinguistic concepts gives a negative contribution to the achievement of students pragmatic skills in accordance with the results of the analysis above it can be concluded that the mastery of sociolinguistic concepts is not a criterion variable that makes a significant contribution to improving pragmatic skills thus the research hypothesis which says that mastery of sociolinguistic concepts makes a significant contribution to the development of pragmatic skills of free methodist  private junior high school students is not proven,20771223,7
7,"Garbage/waste is the residue of human daily activities or comes from natural processes in solid form. Some of the causes that affect the environment are the problems of managing and disposing of waste/household waste. Company ""X"" is a company engaged in waste transportation services and non-hazardous waste management for business sectors such as apartments, offices, hospitals, and hotels. In this problem, there is an increase in the cubication of household waste produced by the vendor company ""X"" every month. Data mining is the extraction of information. Identify hidden information from large amounts of data, leverage and promote knowledge in real-time applications. Clustering is a multidimensional statistic designed to collect similar individuals into homogeneous classes based on observations in variables. The resulting classes can be set according to various structures. This study will cluster data from the volume of levies issued by the Environmental Service from 2010 to 2021 into 3 clustering categories, namely Klassam_0 for low volume of waste generated, Klassam_1 for medium volume of waste generated, and Klassam_2 for the volume of waste generated is high. From the results of this study, there were 8 on Klassam_0, 88 on Klassam_1, and 48 on Klassam_2. The volume of organic and inorganic waste is very good because of the emphasis on the waste management process that occurs in 2021, from the results of the clustering in 1 year (12 months) in 2021 8 months or clusters that are included in klassam¬_0 which can be interpreted as volume of waste ""low"", and 4 months or clusters included in klassam_2 which can be interpreted as ""high"" volume of waste.","Implementation of the waste volume clustering method at company ""x"" to reduce the amount of waste using the k-medoids algorithm",2022-09-08,INTERNATIONAL JOURNAL OF BASIC AND APPLIED SCIENCE,implementation of the waste volume clustering method at company x to reduce the amount of waste using the kmedoids algorithm garbagewaste is the residue of human daily activities or comes from natural processes in solid form some of the causes that affect the environment are the problems of managing and disposing of wastehousehold waste company x is a company engaged in waste transportation services and nonhazardous waste management for business sectors such as apartments offices hospitals and hotels in this problem there is an increase in the cubication of household waste produced by the vendor company x every month data mining is the extraction of information identify hidden information from large amounts of data leverage and promote knowledge in realtime applications clustering is a multidimensional statistic designed to collect similar individuals into homogeneous classes based on observations in variables the resulting classes can be set according to various structures this study will cluster data from the volume of levies issued by the environmental service from  to  into  clustering categories namely klassam_ for low volume of waste generated klassam_ for medium volume of waste generated and klassam_ for the volume of waste generated is high from the results of this study there were  on klassam_  on klassam_ and  on klassam_ the volume of organic and inorganic waste is very good because of the emphasis on the waste management process that occurs in  from the results of the clustering in  year  months in   months or clusters that are included in klassam_ which can be interpreted as volume of waste low and  months or clusters included in klassam_ which can be interpreted as high volume of waste,20771223,7
7,"This study aims to determine: (1) the effectiveness of the learning of physics using guided inquiry methods in terms of improving student learning outcomes, (2) Does the implementation of learning physics using guided inquiry on the subject of ohms law, series and parallel circuits can be involve students, (3) what obstacles or difficulties experienced by students in the implementation of learning physics using guided inquiry on the subject of ohms law, series and parallel circuits and how it can help students to overcome obstacles or difficulties faced by students in learning. The research was carried on in high school Karanu Waikabubak Sumba Barat-NTT on 29 April 2011 until 11 May 2011. Object of research are 15 students in select classes Xd researchers based on the results of a pretest that was done of students as treament or treatment that is given researcher. Data collection include: pretest, postest, learning activities with guided inquiry method using worksheets, student involvement Sheet observations, and interviews. The results showed that the learning of physics using guided inquiry on the subject of ohms law, series and parallel circuits: (1) The effectiveness of learning physics using guided inquiry methods in terms of student learning outcomes by using a test analysis of dependent T-test level α = 0.05 (2) lack of involving students in all learning activities using the methods of guided inquiry, (3) know the obstacles or difficulties the student and knowing how to cope with natural constraints on students.","Implementation of Physics Learning by Using the Guided Inquiry Method on the subject matter of Ohm's Law and Series-parallel Circuits, Effectiveness in terms of Learning Outcomes, Involvement and Constraints",2022-07-01,INTERNATIONAL JOURNAL OF BASIC AND APPLIED SCIENCE,implementation of physics learning by using the guided inquiry method on the subject matter of ohms law and seriesparallel circuits effectiveness in terms of learning outcomes involvement and constraints this study aims to determine  the effectiveness of the learning of physics using guided inquiry methods in terms of improving student learning outcomes  does the implementation of learning physics using guided inquiry on the subject of ohms law series and parallel circuits can be involve students  what obstacles or difficulties experienced by students in the implementation of learning physics using guided inquiry on the subject of ohms law series and parallel circuits and how it can help students to overcome obstacles or difficulties faced by students in learning the research was carried on in high school karanu waikabubak sumba baratntt on  april  until  may  object of research are  students in select classes xd researchers based on the results of a pretest that was done of students as treament or treatment that is given researcher data collection include pretest postest learning activities with guided inquiry method using worksheets student involvement sheet observations and interviews the results showed that the learning of physics using guided inquiry on the subject of ohms law series and parallel circuits  the effectiveness of learning physics using guided inquiry methods in terms of student learning outcomes by using a test analysis of dependent ttest level α     lack of involving students in all learning activities using the methods of guided inquiry  know the obstacles or difficulties the student and knowing how to cope with natural constraints on students,20771223,7
7,"The need for a sense of comfort is one that is very important in human life. Likewise with comfort in a room, especially in the comfort of the office, especially in the boardroom, on campus. The purpose of the design and manufacture of the PIR sensor is as a controller and counter the man when it went into a room, the fan in the living room with a temperature above normal. Hopefully, by the automation system controls the fan and lights in the room temperature can be maintained to keep the temperature stable, and live according to the light intensity of the light that has been programmed.",Design of A Tool to Counter Objects with A Pear Sensor as A Fan and Light Controller Based on An Rtc Based on An ATmega 8535 Microcontroller,2022-07-01,INTERNATIONAL JOURNAL OF BASIC AND APPLIED SCIENCE,design of a tool to counter objects with a pear sensor as a fan and light controller based on an rtc based on an atmega  microcontroller the need for a sense of comfort is one that is very important in human life likewise with comfort in a room especially in the comfort of the office especially in the boardroom on campus the purpose of the design and manufacture of the pir sensor is as a controller and counter the man when it went into a room the fan in the living room with a temperature above normal hopefully by the automation system controls the fan and lights in the room temperature can be maintained to keep the temperature stable and live according to the light intensity of the light that has been programmed,20771223,7
7,"1,2,3-Propanetriol has been oxidized with molecular oxygen and catalysed by heterogeneous catalyst Pd/γ-Al2O3 in water solvent to produce glyceric acid ( 32,62%w ). Glyceric acid was formed then reacted with sodium hydroxide in methanol to produce sodium glycerate ( 27% ). Product of reaction were characterized by FT-IR and 1H-NMR spectroscopy.","Oxidation of 1,2,3 –Propanatriol with Molecular Oxygen Using Pd/Γ-Al2o3 Catalyst in Water Solvent",2022-07-01,INTERNATIONAL JOURNAL OF BASIC AND APPLIED SCIENCE,oxidation of  propanatriol with molecular oxygen using pdγalo catalyst in water solvent propanetriol has been oxidized with molecular oxygen and catalysed by heterogeneous catalyst pdγalo in water solvent to produce glyceric acid  w  glyceric acid was formed then reacted with sodium hydroxide in methanol to produce sodium glycerate    product of reaction were characterized by ftir and hnmr spectroscopy,20771223,7
