jid,desc,title,date,journal,data_cleaned,eissn,jid_umum
7,"Monitoring land surface temperature in Seram Island using cloud computing-based geospatial technology, Google Earth Engine, could help to understand global climate and weather changes, and provide important information for scientists, governments, and non-governmental organizations to make decisions related to climate change mitigation and natural disaster management. This study aims to analyze the spatial pattern of land surface temperature change on Seram Island based on the cloud computing Google Earth engine. This research uses Moderate Resolution Imaging Spectroradiometer (MODIS) Terra Land Surface Temperature and Emissivity 8-day global satellite image data, which are accessed and analyzed in Google Earth Engine and Arc GIS. The results of this study show that the value of land surface temperature on Seram Island in 2017 is 14.7089ᵒC at the lowest value and 30.1012ᵒ C at the highest value and it increased in 2022 where the lowest temperature value is 14.0452ᵒC and the highest temperature is 32.639ᵒC. Built-up land and open land areas on Seram Island have very high surface temperature values compared to forests and plantations which have low land surface temperatures. Analysis of land surface temperature in Seram Island Regency could provide important information for the local government to make policies and plans for sustainable regional development",Spatial pattern of changes in land surface temperature of seram island based on google earth engine cloud computing,2023-06-30,INTERNATIONAL JOURNAL OF BASIC AND APPLIED SCIENCE,spatial pattern of changes in land surface temperature of seram island based on google earth engine cloud computing monitoring land surface temperature in seram island using cloud computingbased geospatial technology google earth engine could help to understand global climate and weather changes and provide important information for scientists governments and nongovernmental organizations to make decisions related to climate change mitigation and natural disaster management this study aims to analyze the spatial pattern of land surface temperature change on seram island based on the cloud computing google earth engine this research uses moderate resolution imaging spectroradiometer modis terra land surface temperature and emissivity day global satellite image data which are accessed and analyzed in google earth engine and arc gis the results of this study show that the value of land surface temperature on seram island in  is  ᵒc at the lowest value and  ᵒ c at the highest value and it increased in  where the lowest temperature value is  ᵒc and the highest temperature is  ᵒc builtup land and open land areas on seram island have very high surface temperature values compared to forests and plantations which have low land surface temperatures analysis of land surface temperature in seram island regency could provide important information for the local government to make policies and plans for sustainable regional development,20771223,7
7,"System of Linear Equation  where  is a non-singular and square matrix .  Method for solving System of Linear Equation consist of direct method and indirect method. Further indirect methods were divided into two, that is stationary and non-stationary. This research will conduct a comparative study of several indirect methods and direct methods in solving several cases of Linear equation systems. Some methods that will be compared in this research are jacobi, gauss-seidel, SOR, conjugate and biconjugate gradient. Testing several methods for some kind of matrix is useful to understand the characteristics of each method in solving different types of matrices. The result show that non-stationary such as conjugate and biconjugate has a less computation and faster to convergence compared to stationary method for several symmetric and non-symmetric matrices",Stationary and non-stationary method for solving system of linear equation,2023-06-30,INTERNATIONAL JOURNAL OF BASIC AND APPLIED SCIENCE,stationary and nonstationary method for solving system of linear equation system of linear equation where is a nonsingular and square matrix  method for solving system of linear equation consist of direct method and indirect method further indirect methods were divided into two that is stationary and nonstationary this research will conduct a comparative study of several indirect methods and direct methods in solving several cases of linear equation systems some methods that will be compared in this research are jacobi gaussseidel sor conjugate and biconjugate gradient testing several methods for some kind of matrix is useful to understand the characteristics of each method in solving different types of matrices the result show that nonstationary such as conjugate and biconjugate has a less computation and faster to convergence compared to stationary method for several symmetric and nonsymmetric matrices,20771223,7
7,"This study applies quantile regression to model the Body Mass Index (BMI) of 152 students from Delta State Polytechnic in Delta State, Nigeria. The BMI serves as the response variable, while skin fold (SK), feeding habit (FH), feeding frequency (FF), and frequency of exercising (FE) are considered as explanatory variables. A comparison is made between the results obtained from the classical linear regression model and quantile regression models at different quantiles (p = 0.1, 0.25, 0.5, 0.75, and 0.9) to examine the impact of the variables on the students' BMI and assess if the relationships differ across quantiles. The findings reveal significant differences between the classical linear regression and quantile regression models, emphasizing the importance of quantile regression in capturing the nuances of the relationship between variables at different points of the BMI distribution. The study highlights the limitations of the classical linear regression model in providing a comprehensive understanding of the data and underscores the value of quantile regression in enhancing our insights into the relationship between BMI and the considered factors. This research contributes to the broader literature on quantile regression and its applications in exploring BMI and related health issues among students",Comparative analysis of linear and quantile regression models in predicting body mass index among students,2023-06-30,INTERNATIONAL JOURNAL OF BASIC AND APPLIED SCIENCE,comparative analysis of linear and quantile regression models in predicting body mass index among students this study applies quantile regression to model the body mass index bmi of  students from delta state polytechnic in delta state nigeria the bmi serves as the response variable while skin fold sk feeding habit fh feeding frequency ff and frequency of exercising fe are considered as explanatory variables a comparison is made between the results obtained from the classical linear regression model and quantile regression models at different quantiles p          and   to examine the impact of the variables on the students bmi and assess if the relationships differ across quantiles the findings reveal significant differences between the classical linear regression and quantile regression models emphasizing the importance of quantile regression in capturing the nuances of the relationship between variables at different points of the bmi distribution the study highlights the limitations of the classical linear regression model in providing a comprehensive understanding of the data and underscores the value of quantile regression in enhancing our insights into the relationship between bmi and the considered factors this research contributes to the broader literature on quantile regression and its applications in exploring bmi and related health issues among students,20771223,7
7,"This study focuses on the development and validation of a urine-based diagnostic model for early detection of Chronic Kidney Disease (CKD). Only urine indicators, hypertension, diabetes mellitus, coronary artery disease, appetite, pedal edema, and anemia, are selected based on their relevance to CKD. A decision tree algorithm is utilized for model development, with specific parameters set for optimal performance. The model is trained and evaluated using two datasets, demonstrating promising results in terms of 100% true positive and true negative rates in validation study. The findings highlight the potential clinical significance and applicability of the developed model for timely interventions in CKD patients.",Exploring the role of urine analysis in early detection of chronic kidney disease,2023-06-30,INTERNATIONAL JOURNAL OF BASIC AND APPLIED SCIENCE,exploring the role of urine analysis in early detection of chronic kidney disease this study focuses on the development and validation of a urinebased diagnostic model for early detection of chronic kidney disease ckd only urine indicators hypertension diabetes mellitus coronary artery disease appetite pedal edema and anemia are selected based on their relevance to ckd a decision tree algorithm is utilized for model development with specific parameters set for optimal performance the model is trained and evaluated using two datasets demonstrating promising results in terms of  true positive and true negative rates in validation study the findings highlight the potential clinical significance and applicability of the developed model for timely interventions in ckd patients,20771223,7
7,"Tussilago farfara L., also known as coltsfoot, is a plant that has been used since ancient times to relieve coughs. Subsequently, the effectiveness of coltsfoot in the treatment of bronchial asthma, pneumonia and other respiratory diseases was established. In this research, the antioxidant and antimicrobial activity of different coltsfoot extracts was analyzed. The antioxidant activity was monitored through the DPPH radical inhibition efficiency and the extract's reducing ability. Antibacterial activity was tested using the diffusion technique. Tussilago farfara L. extracts showed extremely high antioxidant activity in in vitro conditions. The highest antioxidant capacity was found in extracts prepared by mixing water and organic solvents. High antibacterial activity was found for ethanolic, acetone and aqueous-ethanolic extracts of coltsfoot.",Tussilago farfara L.: Antioxidant and antibacterial potential of extracts in in vitro conditions,2023-09-30,INTERNATIONAL JOURNAL OF BASIC AND APPLIED SCIENCE,tussilago farfara l  antioxidant and antibacterial potential of extracts in in vitro conditions tussilago farfara l  also known as coltsfoot is a plant that has been used since ancient times to relieve coughs subsequently the effectiveness of coltsfoot in the treatment of bronchial asthma pneumonia and other respiratory diseases was established in this research the antioxidant and antimicrobial activity of different coltsfoot extracts was analyzed the antioxidant activity was monitored through the dpph radical inhibition efficiency and the extracts reducing ability antibacterial activity was tested using the diffusion technique tussilago farfara l extracts showed extremely high antioxidant activity in in vitro conditions the highest antioxidant capacity was found in extracts prepared by mixing water and organic solvents high antibacterial activity was found for ethanolic acetone and aqueousethanolic extracts of coltsfoot,20771223,7
7,"Fuel use as a primary energy source is increasing daily, and the reserves of these natural resources are diminishing quickly. Different studies have been performed to see the potential use of the seeds of the Nyamplung plant (Chalophyllum inophyllum L.) as biodiesel. To produce biodiesel from Nyamplung oil, a catalyst, such as zeolite, is often required to speed up the reaction, save energy use, and increase the quantity and quality of the biodiesel. There is a high variation in terms of natural zeolite’s catalytic activity, depending on the location where the zeolite was formed in the past. The objectives of this study were to characterize and understand the Ende natural zeolite, before and after activation, and to see the catalytic activity of the HCl-activated zeolite in the production of biodiesel from Nyamplung oil. When zeolite was used as a catalyst, optimum effects on the esterification were observed at 700 rpm stirring speed with a reaction time of 15 minutes. These conditions optimally converted 100% of Nyemplung oil into biodiesel.",Ende natural zeolite as a catalyst in the biodiesel production from nyamplung oil,2023-09-30,INTERNATIONAL JOURNAL OF BASIC AND APPLIED SCIENCE,ende natural zeolite as a catalyst in the biodiesel production from nyamplung oil fuel use as a primary energy source is increasing daily and the reserves of these natural resources are diminishing quickly different studies have been performed to see the potential use of the seeds of the nyamplung plant chalophyllum inophyllum l  as biodiesel to produce biodiesel from nyamplung oil a catalyst such as zeolite is often required to speed up the reaction save energy use and increase the quantity and quality of the biodiesel there is a high variation in terms of natural zeolites catalytic activity depending on the location where the zeolite was formed in the past the objectives of this study were to characterize and understand the ende natural zeolite before and after activation and to see the catalytic activity of the hclactivated zeolite in the production of biodiesel from nyamplung oil when zeolite was used as a catalyst optimum effects on the esterification were observed at  rpm stirring speed with a reaction time of  minutes these conditions optimally converted  of nyemplung oil into biodiesel,20771223,7
7,"Neem based materials are abundant in almost every part of the world. It is allowed to litter the environment and eventually swept and disposed. In this study, neem oil was extracted from neem seeds kernel and its characterization was done by proximate analysis to determine the physico-chemical properties of the oil extracted. From the experiment, the moisture content, oil content, saponification (SAP) value, color and nature at room temperature of the grinded neem seed are 11.4%, 48.4%, 171 mg KOH, golden yellow and liquid, respectively. The primary objective of this work is to formulate an insecticide phytocoil from neem materials. The formulated insecticide phytocoil from both oil and neem leaves can be used as substitute to synthetic insecticides. Examining the repelling ability of the phytocoil confirms its ability to deter mosquitoes for up to 4 hrs in a small toilet room. Packaging as well as the improvement of the methodology of its mass production is suggested to enhance its looks and shape it to acceptable standard",Insecticide phytocoil production from neem based materials and characterization of neem oil extract,2023-06-30,INTERNATIONAL JOURNAL OF BASIC AND APPLIED SCIENCE,insecticide phytocoil production from neem based materials and characterization of neem oil extract neem based materials are abundant in almost every part of the world it is allowed to litter the environment and eventually swept and disposed in this study neem oil was extracted from neem seeds kernel and its characterization was done by proximate analysis to determine the physicochemical properties of the oil extracted from the experiment the moisture content oil content saponification sap value color and nature at room temperature of the grinded neem seed are      mg koh golden yellow and liquid respectively the primary objective of this work is to formulate an insecticide phytocoil from neem materials the formulated insecticide phytocoil from both oil and neem leaves can be used as substitute to synthetic insecticides examining the repelling ability of the phytocoil confirms its ability to deter mosquitoes for up to  hrs in a small toilet room packaging as well as the improvement of the methodology of its mass production is suggested to enhance its looks and shape it to acceptable standard,20771223,7
7,"High drug prices and increasing antibiotic resistance have prompted exploration of natural resources as a source of new antibiotics. The Imperata cylindrica (L.) Beauv. plant is one of the plants used in traditional medicine. Secondary metabolites as bioactive compounds in plants can be obtained through endophytic fungi without having to extract them from plants. Secondary metabolites produced by endophytic fungi can function as raw materials for medicines. This research aims to isolate endophytic fungi and test phytochemicals from Imperata plants to determine the type of secondary metabolites produced. The methods used in this research include isolation and purification of endophytic fungi, identification of endophytic fungi, production of secondary metabolites of endophytic fungi, and screening of phytochemicals resulting from endophytic fungi fermentation. The isolation results showed that there were 7 isolates of endophytic fungi, consisting of 1 isolate from the flower, 3 isolates from the stem, and 3 isolates from the roots. Identification of endophytic fungus using macroscopic and microscopic observations including the genera Fusarium sp., Mucor sp., Penicillium sp., Trichoderma sp., Aspergillus sp., Phytophthora sp. The results of the phytochemical test for endophytic fungi showed that the secondary metabolites produced were flavonoid and saponin compounds. Based on this research, it can be concluded that the endophytic fungi of the Imperata cylindrica (L.) Beauv. plant produces secondary metabolites which have the potential to be developed as medicinal raw material compounds.",Isolation and Phytochemical Testing of Endophytic Fungi from Imperata cylindrica (L.) Beauv plants.,2023-09-30,INTERNATIONAL JOURNAL OF BASIC AND APPLIED SCIENCE,isolation and phytochemical testing of endophytic fungi from imperata cylindrica l  beauv plants high drug prices and increasing antibiotic resistance have prompted exploration of natural resources as a source of new antibiotics the imperata cylindrica l  beauv plant is one of the plants used in traditional medicine secondary metabolites as bioactive compounds in plants can be obtained through endophytic fungi without having to extract them from plants secondary metabolites produced by endophytic fungi can function as raw materials for medicines this research aims to isolate endophytic fungi and test phytochemicals from imperata plants to determine the type of secondary metabolites produced the methods used in this research include isolation and purification of endophytic fungi identification of endophytic fungi production of secondary metabolites of endophytic fungi and screening of phytochemicals resulting from endophytic fungi fermentation the isolation results showed that there were  isolates of endophytic fungi consisting of  isolate from the flower  isolates from the stem and  isolates from the roots identification of endophytic fungus using macroscopic and microscopic observations including the genera fusarium sp  mucor sp  penicillium sp  trichoderma sp  aspergillus sp  phytophthora sp the results of the phytochemical test for endophytic fungi showed that the secondary metabolites produced were flavonoid and saponin compounds based on this research it can be concluded that the endophytic fungi of the imperata cylindrica l  beauv plant produces secondary metabolites which have the potential to be developed as medicinal raw material compounds,20771223,7
7,"Recovering ethanol solutions from filtration, extraction, and stripping operations is done in the distillation column, a separation process unit in the carboxymethyl cellulose production plant. Because the ethanol produced by these techniques is produced at a lower concentration, distillation is required to purify the ethanol. This procedure can raise the concentration of ethanol by separating it from the mixture. The concentration of the ethanol solution needs to be 85% in order to be reused. This case study aims to determine the optimal reflux ratio for a distillation column, model the process in both real-world and manual calculation scenarios using Aspen Hysys software, and evaluate the effects of increasing the reflux ratio. Manual computations yielded a reflux ratio result of 0.91814. In the meantime, an ethanol concentration of 85% is produced by the reflux ratio of 1.080 that is derived from the Aspen Hysys simulation. By generating a heat flow of 1.889 x 106 kJ/h, the ideal reflux ratio of 1.080 was reached, whereas the Aspen Hysys simulation yielded a reflux ratio of 0.91814. This allowed for an ethanol concentration of 85%. The Aspen Hysys simulation yields an ethanol concentration of 82.11% and a heat flow of 1.399 x 106 kJ/h. The ethanol concentration and reboiler steam heat flow are impacted by the reflux ratio value, according to the reflux ratio results. The amount of reboiler steam heat generated may become linear with a larger reflux ratio, and the energy required to complete the distillation process may likewise rise.",Optimization of distillation column reflux ratio for distillate purity and process energy requirements,2023-09-30,INTERNATIONAL JOURNAL OF BASIC AND APPLIED SCIENCE,optimization of distillation column reflux ratio for distillate purity and process energy requirements recovering ethanol solutions from filtration extraction and stripping operations is done in the distillation column a separation process unit in the carboxymethyl cellulose production plant because the ethanol produced by these techniques is produced at a lower concentration distillation is required to purify the ethanol this procedure can raise the concentration of ethanol by separating it from the mixture the concentration of the ethanol solution needs to be  in order to be reused this case study aims to determine the optimal reflux ratio for a distillation column model the process in both realworld and manual calculation scenarios using aspen hysys software and evaluate the effects of increasing the reflux ratio manual computations yielded a reflux ratio result of   in the meantime an ethanol concentration of  is produced by the reflux ratio of   that is derived from the aspen hysys simulation by generating a heat flow of   x  kjh the ideal reflux ratio of   was reached whereas the aspen hysys simulation yielded a reflux ratio of   this allowed for an ethanol concentration of  the aspen hysys simulation yields an ethanol concentration of   and a heat flow of   x  kjh the ethanol concentration and reboiler steam heat flow are impacted by the reflux ratio value according to the reflux ratio results the amount of reboiler steam heat generated may become linear with a larger reflux ratio and the energy required to complete the distillation process may likewise rise,20771223,7
